{"$id":"urn:yalken:r24:corrective:stage-admission-attestation:v1","$schema":"https://json-schema.org/draft/2020-12/schema","additionalProperties":false,"properties":{"acceptanceSignalsDigest":{"pattern":"^[0-9a-f]{64}$","type":"string"},"attestationType":{"const":"STAGE_ADMISSION_ATTESTATION"},"authorityCeiling":{"items":{"minLength":1,"type":"string"},"type":"array","uniqueItems":true},"authorityEpoch":{"type":"string"},"authorityTemplateId":{"type":"string"},"decision":{"const":"INSTANCE_IS_SUBSET_OF_OWNER_APPROVED_TEMPLATE"},"exactIdentity":{"type":"object"},"observedAtUtc":{"type":"string"},"ownerAuthorityBindingDigest":{"pattern":"^[0-9a-f]{64}$","type":"string"},"policyEpoch":{"type":"string"},"programTemplateDigest":{"pattern":"^[0-9a-f]{64}$","type":"string"},"schemaVersion":{"const":"STAGE_ADMISSION_ATTESTATION_V1"},"stageId":{"type":"string"},"stageInstanceDigest":{"pattern":"^[0-9a-f]{64}$","type":"string"},"stageRegistryDigest":{"pattern":"^[0-9a-f]{64}$","type":"string"},"status":{"const":"ADMITTED"},"verifierCodeDigest":{"pattern":"^[0-9a-f]{64}$","type":"string"},"verifierContractDigest":{"pattern":"^[0-9a-f]{64}$","type":"string"},"writeSetDigest":{"pattern":"^[0-9a-f]{64}$","type":"string"}},"required":["schemaVersion","attestationType","status","stageId","stageInstanceDigest","authorityTemplateId","ownerAuthorityBindingDigest","programTemplateDigest","stageRegistryDigest","verifierCodeDigest","verifierContractDigest","exactIdentity","authorityCeiling","writeSetDigest","acceptanceSignalsDigest","authorityEpoch","policyEpoch","observedAtUtc","decision"],"title":"Yalken R2.4 StageAdmissionAttestation V1","type":"object"}
