{"acceptanceSignalsDigest":"2510434d60a82370953aab5af5c7d41d067a318b0fd0e555d568f0a84105c949","attestationType":"STAGE_ADMISSION_ATTESTATION","authorityCeiling":["BOUNDED_CI_OPERATION","BOUNDED_REPOSITORY_WRITE","BRANCH_WORKTREE","COMMIT","LOCAL_TEST_BUILD_EVIDENCE","NON_DESTRUCTIVE_LOCAL_TOOLCHAIN","PROTECTED_NORMAL_MERGE","PR_CREATE_OR_UPDATE","PUSH","READ_ONLY_GITHUB_API"],"authorityEpoch":"YALKEN_R24_OWNER_STANDING_AUTHORITY_V1_1","authorityTemplateId":"OWNER_APPROVED_YALKEN_R24_CORRECTIVE_V1_1","decision":"INSTANCE_IS_SUBSET_OF_OWNER_APPROVED_TEMPLATE","exactIdentity":{"baseSha":"7dabc48f28f7e621292a0ccab2519511ae580fa4","branch":"codex/r24-c6b-editor-accessibility-recovery-v1-20260828","headSha":"7dabc48f28f7e621292a0ccab2519511ae580fa4","targetRemote":"origin","treeSha":"29aed82eede9f9114afcf2e66d5a8a3c156a56e6"},"observedAtUtc":"2026-08-28T19:42:13Z","ownerAuthorityBindingDigest":"be68bd97021d13fbfb75c73791bda7f6bfeebecebf525d4a927d1a4c9fe9efd6","policyEpoch":"YALKEN_R24_CORRECTIVE_POLICY_V1_1","programTemplateDigest":"6c833c964318da3e61e1743365f8763206be838647b5222c187b3bda8d1c6b9a","schemaVersion":"STAGE_ADMISSION_ATTESTATION_V1","stageId":"C6B","stageInstanceDigest":"dd194555421fe12e5803d5a90f0ac72f5f008f9b20f566f7531c78044c6192f5","stageRegistryDigest":"c8af046b5918f43a50af66886b0b5c9d2e22ea6501240d4b239101d8836ced1a","status":"ADMITTED","verifierCodeDigest":"82e49d577b79b41b26b67e25b7ce0fd81f26fb973232194fef8d96d6c563c6f9","verifierContractDigest":"925b4c23f1cad674720ee6a22fcd74cc2169b16bbc161be5d43535f20dd2ee31","writeSetDigest":"158b8f9006133c831aa01ce739c80b40ac057115bbc3e16a5acae733e924562c"}
