{"acceptanceSignalsDigest":"05590127544b0c09c43f20646716084c0da42ce26b71c7864234d791ebe2cffa","attestationType":"STAGE_ADMISSION_ATTESTATION","authorityCeiling":["BOUNDED_CI_OPERATION","BOUNDED_REPOSITORY_WRITE","BRANCH_WORKTREE","COMMIT","LOCAL_TEST_BUILD_EVIDENCE","NON_DESTRUCTIVE_LOCAL_TOOLCHAIN","PROTECTED_NORMAL_MERGE","PR_CREATE_OR_UPDATE","PUSH","READ_ONLY_GITHUB_API"],"authorityEpoch":"YALKEN_R24_OWNER_STANDING_AUTHORITY_V1_1","authorityTemplateId":"OWNER_APPROVED_YALKEN_R24_CORRECTIVE_V1_1","decision":"INSTANCE_IS_SUBSET_OF_OWNER_APPROVED_TEMPLATE","exactIdentity":{"baseSha":"13b2618e1aee21abf74b60c8d2075c17d83247f4","branch":"codex/r24-corrective-c1a-hermetic-toolchain-v1-20260827","headSha":"13b2618e1aee21abf74b60c8d2075c17d83247f4","targetRemote":"origin","treeSha":"9e7987812563905fb0ad3a5e32c213337ba99807"},"observedAtUtc":"2026-08-27T19:55:24Z","ownerAuthorityBindingDigest":"be68bd97021d13fbfb75c73791bda7f6bfeebecebf525d4a927d1a4c9fe9efd6","policyEpoch":"YALKEN_R24_CORRECTIVE_POLICY_V1_1","programTemplateDigest":"6c833c964318da3e61e1743365f8763206be838647b5222c187b3bda8d1c6b9a","schemaVersion":"STAGE_ADMISSION_ATTESTATION_V1","stageId":"C1A","stageInstanceDigest":"456f1098a57de1b24add67f3f3920734d85417a02f56f5a7519a2e77b87479ef","stageRegistryDigest":"c8af046b5918f43a50af66886b0b5c9d2e22ea6501240d4b239101d8836ced1a","status":"ADMITTED","verifierCodeDigest":"82e49d577b79b41b26b67e25b7ce0fd81f26fb973232194fef8d96d6c563c6f9","verifierContractDigest":"925b4c23f1cad674720ee6a22fcd74cc2169b16bbc161be5d43535f20dd2ee31","writeSetDigest":"3408ef0d7887916e2f640c41c2428d48bacb463288b66cb0227527674e43e6d7"}
