{"acceptanceSignalsDigest":"fdde8184988b9570b78d8b74721f4afb5649aaaa0c68044507f588d1f0285dca","attestationType":"STAGE_ADMISSION_ATTESTATION","authorityCeiling":["BOUNDED_CI_OPERATION","BOUNDED_REPOSITORY_WRITE","BRANCH_WORKTREE","COMMIT","LOCAL_TEST_BUILD_EVIDENCE","NON_DESTRUCTIVE_LOCAL_TOOLCHAIN","PROTECTED_NORMAL_MERGE","PR_CREATE_OR_UPDATE","PUSH","READ_ONLY_GITHUB_API"],"authorityEpoch":"YALKEN_R24_OWNER_STANDING_AUTHORITY_V1_1","authorityTemplateId":"OWNER_APPROVED_YALKEN_R24_CORRECTIVE_V1_1","decision":"INSTANCE_IS_SUBSET_OF_OWNER_APPROVED_TEMPLATE","exactIdentity":{"baseSha":"f24cc34277bd05e666dca4a44c079e1160b34b54","branch":"codex/r24-corrective-c5c2-notes-settings-gateway-v1-20260828","headSha":"f24cc34277bd05e666dca4a44c079e1160b34b54","targetRemote":"origin","treeSha":"f7afad7ada796688e83526a60f9efe7e01ccbb56"},"observedAtUtc":"2026-08-28T07:03:46Z","ownerAuthorityBindingDigest":"be68bd97021d13fbfb75c73791bda7f6bfeebecebf525d4a927d1a4c9fe9efd6","policyEpoch":"YALKEN_R24_CORRECTIVE_POLICY_V1_1","programTemplateDigest":"6c833c964318da3e61e1743365f8763206be838647b5222c187b3bda8d1c6b9a","schemaVersion":"STAGE_ADMISSION_ATTESTATION_V1","stageId":"C5C2","stageInstanceDigest":"ae7b4b1e6039101c0898c23693ded2fdc6ca59a5167c69b69a17b359934c1d64","stageRegistryDigest":"c8af046b5918f43a50af66886b0b5c9d2e22ea6501240d4b239101d8836ced1a","status":"ADMITTED","verifierCodeDigest":"82e49d577b79b41b26b67e25b7ce0fd81f26fb973232194fef8d96d6c563c6f9","verifierContractDigest":"925b4c23f1cad674720ee6a22fcd74cc2169b16bbc161be5d43535f20dd2ee31","writeSetDigest":"df27a4f4ccc141fae57acc3e2ab5844df8174c4b7422d54ea65ed7d66740b614"}
