{"acceptanceSignalsDigest":"a05d1a78b17abbbf0a9112f15bc49a08456452a7bf3bed5edef974284b338c23","attestationType":"STAGE_ADMISSION_ATTESTATION","authorityCeiling":["BOUNDED_CI_OPERATION","BOUNDED_REPOSITORY_WRITE","BRANCH_WORKTREE","COMMIT","LOCAL_TEST_BUILD_EVIDENCE","NON_DESTRUCTIVE_LOCAL_TOOLCHAIN","PROTECTED_NORMAL_MERGE","PR_CREATE_OR_UPDATE","PUSH","READ_ONLY_GITHUB_API"],"authorityEpoch":"YALKEN_R24_OWNER_STANDING_AUTHORITY_V1_1","authorityTemplateId":"OWNER_APPROVED_YALKEN_R24_CORRECTIVE_V1_1","decision":"INSTANCE_IS_SUBSET_OF_OWNER_APPROVED_TEMPLATE","exactIdentity":{"baseSha":"b594f92858313d61bc5ad0c49f346148d9958491","branch":"codex/r24-corrective-c6d-fixed-binding-forward-recovery-v1-20260828","headSha":"b594f92858313d61bc5ad0c49f346148d9958491","targetRemote":"origin","treeSha":"9f82de2d975347b715a8ae153ed1c1cad0e727ab"},"observedAtUtc":"2026-08-28T17:04:30Z","ownerAuthorityBindingDigest":"be68bd97021d13fbfb75c73791bda7f6bfeebecebf525d4a927d1a4c9fe9efd6","policyEpoch":"YALKEN_R24_CORRECTIVE_POLICY_V1_1","programTemplateDigest":"6c833c964318da3e61e1743365f8763206be838647b5222c187b3bda8d1c6b9a","schemaVersion":"STAGE_ADMISSION_ATTESTATION_V1","stageId":"C6D","stageInstanceDigest":"4a6e5db0853000f070746624ec4883b8e925b13a8bedeb1b9ecfbeb362936461","stageRegistryDigest":"c8af046b5918f43a50af66886b0b5c9d2e22ea6501240d4b239101d8836ced1a","status":"ADMITTED","verifierCodeDigest":"82e49d577b79b41b26b67e25b7ce0fd81f26fb973232194fef8d96d6c563c6f9","verifierContractDigest":"925b4c23f1cad674720ee6a22fcd74cc2169b16bbc161be5d43535f20dd2ee31","writeSetDigest":"3bbfa6f7880f75b6f104467ae5ce993f5e904b4dff4db9843e26d347702e594e"}
