{"acceptanceSignalsDigest":"273aa167818ba98e7d9e47c88bd57f8a5da4c9e8918f57bab7e40b27ec01448b","attestationType":"STAGE_ADMISSION_ATTESTATION","authorityCeiling":["BOUNDED_CI_OPERATION","BOUNDED_REPOSITORY_WRITE","BRANCH_WORKTREE","COMMIT","LOCAL_TEST_BUILD_EVIDENCE","NON_DESTRUCTIVE_LOCAL_TOOLCHAIN","PROTECTED_NORMAL_MERGE","PR_CREATE_OR_UPDATE","PUSH","READ_ONLY_GITHUB_API"],"authorityEpoch":"YALKEN_R24_MAIN_PRODUCT_WP401_AUTHORITY_EPOCH_V4","authorityTemplateId":"OWNER_AUTHORIZED_YALKEN_R24_WP401_BOOK_SNAPSHOT_V4","decision":"INSTANCE_IS_SUBSET_OF_OWNER_APPROVED_TEMPLATE","exactIdentity":{"baseSha":"9aae563b18578a052fffc434b3f37257248092a0","branch":"codex/r24-wp401-book-snapshot-v1-20260831","headSha":"9aae563b18578a052fffc434b3f37257248092a0","targetRemote":"origin","treeSha":"b58795b702cbbdd920d4470f3ea67de1fdfadfa2"},"observedAtUtc":"2026-08-31T16:43:52Z","ownerAuthorityBindingDigest":"be68bd97021d13fbfb75c73791bda7f6bfeebecebf525d4a927d1a4c9fe9efd6","policyEpoch":"YALKEN_R24_MAIN_PRODUCT_WP401_POLICY_EPOCH_V4","programTemplateDigest":"69fc9e600d22019bfee17af97765566388f2a96ecb311e5b34cff75f7b2caed3","schemaVersion":"STAGE_ADMISSION_ATTESTATION_V1","stageId":"WP-401_BOOK_SNAPSHOT","stageInstanceDigest":"12f485e3607df00da29817efeaa25a2da467d8b622dd7c3622344b1602636785","stageRegistryDigest":"c4ee0eae8e8f7522c32e56fee3c31964c64cd91c4f769659f50b5d51c29f557b","status":"ADMITTED","verifierCodeDigest":"82e49d577b79b41b26b67e25b7ce0fd81f26fb973232194fef8d96d6c563c6f9","verifierContractDigest":"925b4c23f1cad674720ee6a22fcd74cc2169b16bbc161be5d43535f20dd2ee31","writeSetDigest":"ba7e04d030ffd942913a1dd7d09a0e4c0c12d0df5391b84f70048146afcd6d0e"}
