{"acceptanceSignalsDigest":"41be732dd240e02f5c22820506dd1e95819a6e56b69735f617d98c34c4df8a7c","attestationType":"STAGE_ADMISSION_ATTESTATION","authorityCeiling":["BOUNDED_CI_OPERATION","BOUNDED_REPOSITORY_WRITE","BRANCH_WORKTREE","COMMIT","LOCAL_TEST_BUILD_EVIDENCE","NON_DESTRUCTIVE_LOCAL_TOOLCHAIN","PROTECTED_NORMAL_MERGE","PR_CREATE_OR_UPDATE","PUSH","READ_ONLY_GITHUB_API"],"authorityEpoch":"YALKEN_R24_OWNER_STANDING_AUTHORITY_V1_1","authorityTemplateId":"OWNER_APPROVED_YALKEN_R24_CORRECTIVE_V1_1","decision":"INSTANCE_IS_SUBSET_OF_OWNER_APPROVED_TEMPLATE","exactIdentity":{"baseSha":"a044da92cc85cbe54a7261a4c7430c83d7e85dbd","branch":"codex/r24-corrective-c8e-v3-package-compiler-v1-20260829","headSha":"a044da92cc85cbe54a7261a4c7430c83d7e85dbd","targetRemote":"origin","treeSha":"a0cd27dc14381c0c93f0c8fc5961814c8f77ae91"},"observedAtUtc":"2026-08-29T04:28:22Z","ownerAuthorityBindingDigest":"be68bd97021d13fbfb75c73791bda7f6bfeebecebf525d4a927d1a4c9fe9efd6","policyEpoch":"YALKEN_R24_CORRECTIVE_POLICY_V1_1","programTemplateDigest":"6c833c964318da3e61e1743365f8763206be838647b5222c187b3bda8d1c6b9a","schemaVersion":"STAGE_ADMISSION_ATTESTATION_V1","stageId":"C8E","stageInstanceDigest":"6d6ea53145265bf31465b81b7d0f0dfd66fa5dce35c2edd859e217af92eca696","stageRegistryDigest":"c8af046b5918f43a50af66886b0b5c9d2e22ea6501240d4b239101d8836ced1a","status":"ADMITTED","verifierCodeDigest":"82e49d577b79b41b26b67e25b7ce0fd81f26fb973232194fef8d96d6c563c6f9","verifierContractDigest":"925b4c23f1cad674720ee6a22fcd74cc2169b16bbc161be5d43535f20dd2ee31","writeSetDigest":"2e7745d7f573de705e1e3c91dfbbb9bd7fa65282582e17c52adf439de7573752"}
